23:25:10.834732 IP soccf-snr6-009.d2.comp.nus.edu.sg.55668 > 74.125.24.17.https: Flags [S], seq 3536336526, win 29200, options [mss 1460,sackOK,TS val 2508685630 ecr 0,nop,wscale 7], length 0
23:25:10.837079 IP soccf-snr6-009.d2.comp.nus.edu.sg.55668 > 74.125.24.17.https: Flags [.], ack 1510360991, win 229, options [nop,nop,TS val 2508685632 ecr 100741101], length 0
23:25:10.837334 IP soccf-snr6-009.d2.comp.nus.edu.sg.55668 > 74.125.24.17.https: Flags [P.], seq 0:517, ack 1, win 229, options [nop,nop,TS val 2508685633 ecr 100741101], length 517
23:25:10.840302 IP soccf-snr6-009.d2.comp.nus.edu.sg.55668 > 74.125.24.17.https: Flags [.], ack 157, win 237, options [nop,nop,TS val 2508685636 ecr 100741104], length 0
23:25:10.840498 IP soccf-snr6-009.d2.comp.nus.edu.sg.55668 > 74.125.24.17.https: Flags [P.], seq 517:568, ack 157, win 237, options [nop,nop,TS val 2508685636 ecr 100741104], length 51
23:25:10.840680 IP soccf-snr6-009.d2.comp.nus.edu.sg.55668 > 74.125.24.17.https: Flags [P.], seq 568:745, ack 157, win 237, options [nop,nop,TS val 2508685636 ecr 100741104], length 177
23:25:10.840701 IP soccf-snr6-009.d2.comp.nus.edu.sg.55668 > 74.125.24.17.https: Flags [P.], seq 745:1297, ack 157, win 237, options [nop,nop,TS val 2508685636 ecr 100741104], length 552
23:25:10.846585 IP soccf-snr6-009.d2.comp.nus.edu.sg.55668 > 74.125.24.17.https: Flags [P.], seq 1297:1335, ack 264, win 237, options [nop,nop,TS val 2508685642 ecr 100741107], length 38
23:25:11.452368 IP soccf-snr6-009.d2.comp.nus.edu.sg.55668 > 74.125.24.17.https: Flags [.], ack 832, win 245, options [nop,nop,TS val 2508686248 ecr 100741704], length 0
23:25:11.452534 IP soccf-snr6-009.d2.comp.nus.edu.sg.55668 > 74.125.24.17.https: Flags [P.], seq 1335:1381, ack 878, win 245, options [nop,nop,TS val 2508686248 ecr 100741716], length 46
23:25:14.116974 IP soccf-snr6-009.d2.comp.nus.edu.sg.55668 > 74.125.24.17.https: Flags [P.], seq 1381:2361, ack 878, win 245, options [nop,nop,TS val 2508688912 ecr 100741719], length 980
23:25:14.150653 IP soccf-snr6-009.d2.comp.nus.edu.sg.55668 > 74.125.24.17.https: Flags [.], ack 2540, win 275, options [nop,nop,TS val 2508688946 ecr 100744414], length 0
23:25:14.150855 IP soccf-snr6-009.d2.comp.nus.edu.sg.55668 > 74.125.24.17.https: Flags [P.], seq 2361:2407, ack 2586, win 275, options [nop,nop,TS val 2508688946 ecr 100744415], length 46
23:25:14.152476 IP soccf-snr6-009.d2.comp.nus.edu.sg.55668 > 74.125.24.17.https: Flags [P.], seq 2407:2996, ack 2586, win 275, options [nop,nop,TS val 2508688948 ecr 100744415], length 589
23:25:14.393983 IP soccf-snr6-009.d2.comp.nus.edu.sg.55668 > 74.125.24.17.https: Flags [.], ack 3215, win 305, options [nop,nop,TS val 2508689189 ecr 100744658], length 0
23:25:14.394007 IP soccf-snr6-009.d2.comp.nus.edu.sg.55668 > 74.125.24.17.https: Flags [P.], seq 2996:3042, ack 3215, win 305, options [nop,nop,TS val 2508689189 ecr 100744658], length 46
23:25:14.395693 IP soccf-snr6-009.d2.comp.nus.edu.sg.55668 > 74.125.24.17.https: Flags [P.], seq 3042:3126, ack 3215, win 305, options [nop,nop,TS val 2508689191 ecr 100744658], length 84
23:25:14.645014 IP soccf-snr6-009.d2.comp.nus.edu.sg.55668 > 74.125.24.17.https: Flags [.], ack 5654, win 349, options [nop,nop,TS val 2508689440 ecr 100744909], length 0
23:25:14.645272 IP soccf-snr6-009.d2.comp.nus.edu.sg.55668 > 74.125.24.17.https: Flags [.], ack 6148, win 370, options [nop,nop,TS val 2508689440 ecr 100744909], length 0
23:25:14.645302 IP soccf-snr6-009.d2.comp.nus.edu.sg.55668 > 74.125.24.17.https: Flags [P.], seq 3126:3172, ack 6148, win 370, options [nop,nop,TS val 2508689441 ecr 100744909], length 46
23:25:14.647095 IP soccf-snr6-009.d2.comp.nus.edu.sg.55668 > 74.125.24.17.https: Flags [P.], seq 3172:3398, ack 6148, win 370, options [nop,nop,TS val 2508689442 ecr 100744909], length 226
23:25:15.276577 IP soccf-snr6-009.d2.comp.nus.edu.sg.55668 > 74.125.24.17.https: Flags [.], ack 8065, win 414, options [nop,nop,TS val 2508690072 ecr 100745540], length 0
23:25:15.276624 IP soccf-snr6-009.d2.comp.nus.edu.sg.55668 > 74.125.24.17.https: Flags [.], ack 10971, win 461, options [nop,nop,TS val 2508690072 ecr 100745540], length 0
23:25:15.288870 IP soccf-snr6-009.d2.comp.nus.edu.sg.55668 > 74.125.24.17.https: Flags [.], ack 13707, win 506, options [nop,nop,TS val 2508690084 ecr 100745553], length 0
23:25:15.288880 IP soccf-snr6-009.d2.comp.nus.edu.sg.55668 > 74.125.24.17.https: Flags [.], ack 15275, win 530, options [nop,nop,TS val 2508690084 ecr 100745553], length 0
23:25:15.289252 IP soccf-snr6-009.d2.comp.nus.edu.sg.55668 > 74.125.24.17.https: Flags [.], ack 19379, win 596, options [nop,nop,TS val 2508690085 ecr 100745553], length 0
23:25:15.289596 IP soccf-snr6-009.d2.comp.nus.edu.sg.55668 > 74.125.24.17.https: Flags [.], ack 19884, win 639, options [nop,nop,TS val 2508690085 ecr 100745553], length 0
23:25:15.343840 IP soccf-snr6-009.d2.comp.nus.edu.sg.55668 > 74.125.24.17.https: Flags [.], ack 22620, win 684, options [nop,nop,TS val 2508690139 ecr 100745608], length 0
23:25:15.343847 IP soccf-snr6-009.d2.comp.nus.edu.sg.55668 > 74.125.24.17.https: Flags [.], ack 24221, win 709, options [nop,nop,TS val 2508690139 ecr 100745608], length 0
23:25:15.344066 IP soccf-snr6-009.d2.comp.nus.edu.sg.55668 > 74.125.24.17.https: Flags [.], ack 28325, win 774, options [nop,nop,TS val 2508690139 ecr 100745608], length 0
23:25:15.344625 IP soccf-snr6-009.d2.comp.nus.edu.sg.55668 > 74.125.24.17.https: Flags [.], ack 30035, win 818, options [nop,nop,TS val 2508690140 ecr 100745608], length 0
23:25:15.344632 IP soccf-snr6-009.d2.comp.nus.edu.sg.55668 > 74.125.24.17.https: Flags [.], ack 32771, win 861, options [nop,nop,TS val 2508690140 ecr 100745608], length 0
23:25:15.345429 IP soccf-snr6-009.d2.comp.nus.edu.sg.55668 > 74.125.24.17.https: Flags [.], ack 34309, win 905, options [nop,nop,TS val 2508690141 ecr 100745609], length 0
23:25:15.345438 IP soccf-snr6-009.d2.comp.nus.edu.sg.55668 > 74.125.24.17.https: Flags [.], ack 37045, win 948, options [nop,nop,TS val 2508690141 ecr 100745609], length 0
23:25:15.362620 IP soccf-snr6-009.d2.comp.nus.edu.sg.55668 > 74.125.24.17.https: Flags [.], ack 38634, win 992, options [nop,nop,TS val 2508690158 ecr 100745609], length 0
23:25:15.362631 IP soccf-snr6-009.d2.comp.nus.edu.sg.55668 > 74.125.24.17.https: Flags [.], ack 41370, win 1034, options [nop,nop,TS val 2508690158 ecr 100745627], length 0
23:25:15.362860 IP soccf-snr6-009.d2.comp.nus.edu.sg.55668 > 74.125.24.17.https: Flags [.], ack 42993, win 1078, options [nop,nop,TS val 2508690158 ecr 100745627], length 0
23:25:15.362869 IP soccf-snr6-009.d2.comp.nus.edu.sg.55668 > 74.125.24.17.https: Flags [.], ack 45729, win 1121, options [nop,nop,TS val 2508690158 ecr 100745627], length 0
23:25:15.363402 IP soccf-snr6-009.d2.comp.nus.edu.sg.55668 > 74.125.24.17.https: Flags [.], ack 47316, win 1165, options [nop,nop,TS val 2508690159 ecr 100745627], length 0
23:25:15.363411 IP soccf-snr6-009.d2.comp.nus.edu.sg.55668 > 74.125.24.17.https: Flags [.], ack 50052, win 1208, options [nop,nop,TS val 2508690159 ecr 100745627], length 0
23:25:15.364072 IP soccf-snr6-009.d2.comp.nus.edu.sg.55668 > 74.125.24.17.https: Flags [.], ack 51587, win 1252, options [nop,nop,TS val 2508690159 ecr 100745627], length 0
23:25:15.364092 IP soccf-snr6-009.d2.comp.nus.edu.sg.55668 > 74.125.24.17.https: Flags [.], ack 54323, win 1295, options [nop,nop,TS val 2508690159 ecr 100745628], length 0
23:25:15.405407 IP soccf-snr6-009.d2.comp.nus.edu.sg.55668 > 74.125.24.17.https: Flags [.], ack 54672, win 1316, options [nop,nop,TS val 2508690159 ecr 100745628], length 0
23:25:15.408398 IP soccf-snr6-009.d2.comp.nus.edu.sg.55668 > 74.125.24.17.https: Flags [.], ack 56040, win 1339, options [nop,nop,TS val 2508690204 ecr 100745672], length 0
23:25:15.408408 IP soccf-snr6-009.d2.comp.nus.edu.sg.55668 > 74.125.24.17.https: Flags [.], ack 57408, win 1361, options [nop,nop,TS val 2508690204 ecr 100745672], length 0
23:25:15.408657 IP soccf-snr6-009.d2.comp.nus.edu.sg.55668 > 74.125.24.17.https: Flags [.], ack 61512, win 1425, options [nop,nop,TS val 2508690204 ecr 100745672], length 0
23:25:15.408668 IP soccf-snr6-009.d2.comp.nus.edu.sg.55668 > 74.125.24.17.https: Flags [.], ack 63317, win 1417, options [nop,nop,TS val 2508690204 ecr 100745672], length 0
23:25:15.408788 IP soccf-snr6-009.d2.comp.nus.edu.sg.55668 > 74.125.24.17.https: Flags [.], ack 64685, win 1444, options [nop,nop,TS val 2508690204 ecr 100745673], length 0
23:25:15.408795 IP soccf-snr6-009.d2.comp.nus.edu.sg.55668 > 74.125.24.17.https: Flags [.], ack 67421, win 1432, options [nop,nop,TS val 2508690204 ecr 100745673], length 0
23:25:15.408802 IP soccf-snr6-009.d2.comp.nus.edu.sg.55668 > 74.125.24.17.https: Flags [.], ack 67700, win 1430, options [nop,nop,TS val 2508690204 ecr 100745673], length 0
23:25:15.409594 IP soccf-snr6-009.d2.comp.nus.edu.sg.55668 > 74.125.24.17.https: Flags [.], ack 69068, win 1444, options [nop,nop,TS val 2508690205 ecr 100745673], length 0
23:25:15.409603 IP soccf-snr6-009.d2.comp.nus.edu.sg.55668 > 74.125.24.17.https: Flags [.], ack 71472, win 1432, options [nop,nop,TS val 2508690205 ecr 100745673], length 0
23:25:15.501595 IP soccf-snr6-009.d2.comp.nus.edu.sg.55668 > 74.125.24.17.https: Flags [.], ack 72217, win 1444, options [nop,nop,TS val 2508690297 ecr 100745766], length 0
23:25:15.502035 IP soccf-snr6-009.d2.comp.nus.edu.sg.55668 > 74.125.24.17.https: Flags [.], ack 73585, win 1444, options [nop,nop,TS val 2508690297 ecr 100745766], length 0
23:25:15.502044 IP soccf-snr6-009.d2.comp.nus.edu.sg.55668 > 74.125.24.17.https: Flags [.], ack 76321, win 1432, options [nop,nop,TS val 2508690297 ecr 100745766], length 0
23:25:15.502050 IP soccf-snr6-009.d2.comp.nus.edu.sg.55668 > 74.125.24.17.https: Flags [.], ack 76548, win 1431, options [nop,nop,TS val 2508690297 ecr 100745766], length 0
23:25:15.502862 IP soccf-snr6-009.d2.comp.nus.edu.sg.55668 > 74.125.24.17.https: Flags [.], ack 77916, win 1444, options [nop,nop,TS val 2508690298 ecr 100745766], length 0
23:25:15.502888 IP soccf-snr6-009.d2.comp.nus.edu.sg.55668 > 74.125.24.17.https: Flags [.], ack 80652, win 1432, options [nop,nop,TS val 2508690298 ecr 100745766], length 0
23:25:15.502897 IP soccf-snr6-009.d2.comp.nus.edu.sg.55668 > 74.125.24.17.https: Flags [.], ack 80837, win 1431, options [nop,nop,TS val 2508690298 ecr 100745766], length 0
23:25:15.503423 IP soccf-snr6-009.d2.comp.nus.edu.sg.55668 > 74.125.24.17.https: Flags [.], ack 82205, win 1444, options [nop,nop,TS val 2508690299 ecr 100745767], length 0
23:25:15.503430 IP soccf-snr6-009.d2.comp.nus.edu.sg.55668 > 74.125.24.17.https: Flags [.], ack 84941, win 1432, options [nop,nop,TS val 2508690299 ecr 100745767], length 0
23:25:15.503434 IP soccf-snr6-009.d2.comp.nus.edu.sg.55668 > 74.125.24.17.https: Flags [.], ack 85148, win 1431, options [nop,nop,TS val 2508690299 ecr 100745767], length 0
23:25:15.503629 IP soccf-snr6-009.d2.comp.nus.edu.sg.55668 > 74.125.24.17.https: Flags [.], ack 87884, win 1439, options [nop,nop,TS val 2508690299 ecr 100745767], length 0
23:25:15.503839 IP soccf-snr6-009.d2.comp.nus.edu.sg.55668 > 74.125.24.17.https: Flags [.], ack 88502, win 1444, options [nop,nop,TS val 2508690299 ecr 100745767], length 0
23:25:15.509399 IP soccf-snr6-009.d2.comp.nus.edu.sg.55668 > 74.125.24.17.https: Flags [P.], seq 3398:3758, ack 88502, win 1444, options [nop,nop,TS val 2508690305 ecr 100745767], length 360
23:25:15.509807 IP soccf-snr6-009.d2.comp.nus.edu.sg.55668 > 74.125.24.17.https: Flags [P.], seq 3758:3907, ack 88502, win 1444, options [nop,nop,TS val 2508690305 ecr 100745767], length 149
23:25:15.512624 IP soccf-snr6-009.d2.comp.nus.edu.sg.55668 > 74.125.24.17.https: Flags [.], ack 90914, win 1439, options [nop,nop,TS val 2508690308 ecr 100745777], length 0
23:25:15.512989 IP soccf-snr6-009.d2.comp.nus.edu.sg.55668 > 74.125.24.17.https: Flags [P.], seq 3907:3953, ack 90960, win 1444, options [nop,nop,TS val 2508690308 ecr 100745777], length 46
23:25:15.513390 IP soccf-snr6-009.d2.comp.nus.edu.sg.55668 > 74.125.24.17.https: Flags [.], ack 92504, win 1444, options [nop,nop,TS val 2508690309 ecr 100745777], length 0
23:25:15.513600 IP soccf-snr6-009.d2.comp.nus.edu.sg.55668 > 74.125.24.17.https: Flags [.], ack 97976, win 1432, options [nop,nop,TS val 2508690309 ecr 100745777], length 0
23:25:15.513653 IP soccf-snr6-009.d2.comp.nus.edu.sg.55668 > 74.125.24.17.https: Flags [.], ack 104816, win 1394, options [nop,nop,TS val 2508690309 ecr 100745777], length 0
23:25:15.513696 IP soccf-snr6-009.d2.comp.nus.edu.sg.55668 > 74.125.24.17.https: Flags [.], ack 110288, win 1364, options [nop,nop,TS val 2508690309 ecr 100745777], length 0
23:25:15.514238 IP soccf-snr6-009.d2.comp.nus.edu.sg.55668 > 74.125.24.17.https: Flags [.], ack 115760, win 1424, options [nop,nop,TS val 2508690310 ecr 100745777], length 0
23:25:15.514290 IP soccf-snr6-009.d2.comp.nus.edu.sg.55668 > 74.125.24.17.https: Flags [.], ack 119864, win 1402, options [nop,nop,TS val 2508690310 ecr 100745777], length 0
23:25:15.514348 IP soccf-snr6-009.d2.comp.nus.edu.sg.55668 > 74.125.24.17.https: Flags [.], ack 126704, win 1364, options [nop,nop,TS val 2508690310 ecr 100745777], length 0
23:25:15.515016 IP soccf-snr6-009.d2.comp.nus.edu.sg.55668 > 74.125.24.17.https: Flags [.], ack 129440, win 1444, options [nop,nop,TS val 2508690310 ecr 100745777], length 0
23:25:15.515432 IP soccf-snr6-009.d2.comp.nus.edu.sg.55668 > 74.125.24.17.https: Flags [.], ack 133544, win 1432, options [nop,nop,TS val 2508690311 ecr 100745778], length 0
23:25:15.515475 IP soccf-snr6-009.d2.comp.nus.edu.sg.55668 > 74.125.24.17.https: Flags [.], ack 139016, win 1444, options [nop,nop,TS val 2508690311 ecr 100745778], length 0
23:25:15.515851 IP soccf-snr6-009.d2.comp.nus.edu.sg.55668 > 74.125.24.17.https: Flags [.], ack 144488, win 1531, options [nop,nop,TS val 2508690311 ecr 100745779], length 0
23:25:15.516397 IP soccf-snr6-009.d2.comp.nus.edu.sg.55668 > 74.125.24.17.https: Flags [.], ack 148592, win 1595, options [nop,nop,TS val 2508690312 ecr 100745780], length 0
23:25:15.516444 IP soccf-snr6-009.d2.comp.nus.edu.sg.55668 > 74.125.24.17.https: Flags [.], ack 154064, win 1681, options [nop,nop,TS val 2508690312 ecr 100745780], length 0
23:25:15.516494 IP soccf-snr6-009.d2.comp.nus.edu.sg.55668 > 74.125.24.17.https: Flags [.], ack 160904, win 1787, options [nop,nop,TS val 2508690312 ecr 100745780], length 0
23:25:15.517421 IP soccf-snr6-009.d2.comp.nus.edu.sg.55668 > 74.125.24.17.https: Flags [.], ack 166376, win 1874, options [nop,nop,TS val 2508690313 ecr 100745780], length 0
23:25:15.517432 IP soccf-snr6-009.d2.comp.nus.edu.sg.55668 > 74.125.24.17.https: Flags [.], ack 169112, win 1917, options [nop,nop,TS val 2508690313 ecr 100745781], length 0
23:25:15.517463 IP soccf-snr6-009.d2.comp.nus.edu.sg.55668 > 74.125.24.17.https: Flags [.], ack 171848, win 1960, options [nop,nop,TS val 2508690313 ecr 100745781], length 0
23:25:15.517511 IP soccf-snr6-009.d2.comp.nus.edu.sg.55668 > 74.125.24.17.https: Flags [.], ack 178688, win 2067, options [nop,nop,TS val 2508690313 ecr 100745781], length 0
23:25:15.518234 IP soccf-snr6-009.d2.comp.nus.edu.sg.55668 > 74.125.24.17.https: Flags [.], ack 184160, win 2153, options [nop,nop,TS val 2508690314 ecr 100745781], length 0
23:25:15.518284 IP soccf-snr6-009.d2.comp.nus.edu.sg.55668 > 74.125.24.17.https: Flags [.], ack 189632, win 2231, options [nop,nop,TS val 2508690314 ecr 100745781], length 0
23:25:15.518340 IP soccf-snr6-009.d2.comp.nus.edu.sg.55668 > 74.125.24.17.https: Flags [.], ack 196472, win 2193, options [nop,nop,TS val 2508690314 ecr 100745781], length 0
23:25:15.518392 IP soccf-snr6-009.d2.comp.nus.edu.sg.55668 > 74.125.24.17.https: Flags [.], ack 200576, win 2171, options [nop,nop,TS val 2508690314 ecr 100745781], length 0
23:25:15.519426 IP soccf-snr6-009.d2.comp.nus.edu.sg.55668 > 74.125.24.17.https: Flags [.], ack 206048, win 2238, options [nop,nop,TS val 2508690315 ecr 100745781], length 0
23:25:15.519487 IP soccf-snr6-009.d2.comp.nus.edu.sg.55668 > 74.125.24.17.https: Flags [.], ack 210152, win 2231, options [nop,nop,TS val 2508690315 ecr 100745782], length 0
23:25:15.519535 IP soccf-snr6-009.d2.comp.nus.edu.sg.55668 > 74.125.24.17.https: Flags [.], ack 216992, win 2193, options [nop,nop,TS val 2508690315 ecr 100745782], length 0
23:25:15.519575 IP soccf-snr6-009.d2.comp.nus.edu.sg.55668 > 74.125.24.17.https: Flags [.], ack 221096, win 2171, options [nop,nop,TS val 2508690315 ecr 100745783], length 0
23:25:15.520391 IP soccf-snr6-009.d2.comp.nus.edu.sg.55668 > 74.125.24.17.https: Flags [.], ack 225200, win 2238, options [nop,nop,TS val 2508690316 ecr 100745783], length 0
23:25:15.520440 IP soccf-snr6-009.d2.comp.nus.edu.sg.55668 > 74.125.24.17.https: Flags [.], ack 230672, win 2323, options [nop,nop,TS val 2508690316 ecr 100745783], length 0
23:25:15.520491 IP soccf-snr6-009.d2.comp.nus.edu.sg.55668 > 74.125.24.17.https: Flags [.], ack 237512, win 2430, options [nop,nop,TS val 2508690316 ecr 100745783], length 0
23:25:15.520538 IP soccf-snr6-009.d2.comp.nus.edu.sg.55668 > 74.125.24.17.https: Flags [.], ack 240248, win 2473, options [nop,nop,TS val 2508690316 ecr 100745783], length 0
23:25:15.521376 IP soccf-snr6-009.d2.comp.nus.edu.sg.55668 > 74.125.24.17.https: Flags [.], ack 244352, win 2537, options [nop,nop,TS val 2508690317 ecr 100745783], length 0
23:25:15.521431 IP soccf-snr6-009.d2.comp.nus.edu.sg.55668 > 74.125.24.17.https: Flags [.], ack 249824, win 2623, options [nop,nop,TS val 2508690317 ecr 100745783], length 0
23:25:15.521472 IP soccf-snr6-009.d2.comp.nus.edu.sg.55668 > 74.125.24.17.https: Flags [.], ack 256664, win 2730, options [nop,nop,TS val 2508690317 ecr 100745783], length 0
23:25:15.521523 IP soccf-snr6-009.d2.comp.nus.edu.sg.55668 > 74.125.24.17.https: Flags [.], ack 259400, win 2772, options [nop,nop,TS val 2508690317 ecr 100745783], length 0
23:25:15.522240 IP soccf-snr6-009.d2.comp.nus.edu.sg.55668 > 74.125.24.17.https: Flags [.], ack 263504, win 2836, options [nop,nop,TS val 2508690318 ecr 100745783], length 0
23:25:15.522286 IP soccf-snr6-009.d2.comp.nus.edu.sg.55668 > 74.125.24.17.https: Flags [.], ack 266240, win 2879, options [nop,nop,TS val 2508690318 ecr 100745783], length 0
23:25:15.522296 IP soccf-snr6-009.d2.comp.nus.edu.sg.55668 > 74.125.24.17.https: Flags [.], ack 270344, win 2943, options [nop,nop,TS val 2508690318 ecr 100745784], length 0
23:25:15.522338 IP soccf-snr6-009.d2.comp.nus.edu.sg.55668 > 74.125.24.17.https: Flags [.], ack 275816, win 3029, options [nop,nop,TS val 2508690318 ecr 100745784], length 0
23:25:15.522389 IP soccf-snr6-009.d2.comp.nus.edu.sg.55668 > 74.125.24.17.https: Flags [.], ack 279920, win 3093, options [nop,nop,TS val 2508690318 ecr 100745784], length 0
23:25:15.523229 IP soccf-snr6-009.d2.comp.nus.edu.sg.55668 > 74.125.24.17.https: Flags [.], ack 284024, win 3157, options [nop,nop,TS val 2508690319 ecr 100745784], length 0
23:25:15.523279 IP soccf-snr6-009.d2.comp.nus.edu.sg.55668 > 74.125.24.17.https: Flags [.], ack 289496, win 3184, options [nop,nop,TS val 2508690319 ecr 100745784], length 0
23:25:15.523339 IP soccf-snr6-009.d2.comp.nus.edu.sg.55668 > 74.125.24.17.https: Flags [.], ack 296336, win 3167, options [nop,nop,TS val 2508690319 ecr 100745784], length 0
23:25:15.523391 IP soccf-snr6-009.d2.comp.nus.edu.sg.55668 > 74.125.24.17.https: Flags [.], ack 299072, win 3152, options [nop,nop,TS val 2508690319 ecr 100745784], length 0
23:25:15.524396 IP soccf-snr6-009.d2.comp.nus.edu.sg.55668 > 74.125.24.17.https: Flags [.], ack 303176, win 3184, options [nop,nop,TS val 2508690320 ecr 100745784], length 0
23:25:15.524442 IP soccf-snr6-009.d2.comp.nus.edu.sg.55668 > 74.125.24.17.https: Flags [.], ack 308648, win 3184, options [nop,nop,TS val 2508690320 ecr 100745784], length 0
23:25:15.524499 IP soccf-snr6-009.d2.comp.nus.edu.sg.55668 > 74.125.24.17.https: Flags [.], ack 315488, win 3167, options [nop,nop,TS val 2508690320 ecr 100745784], length 0
23:25:15.524552 IP soccf-snr6-009.d2.comp.nus.edu.sg.55668 > 74.125.24.17.https: Flags [.], ack 319592, win 3145, options [nop,nop,TS val 2508690320 ecr 100745784], length 0
23:25:15.525440 IP soccf-snr6-009.d2.comp.nus.edu.sg.55668 > 74.125.24.17.https: Flags [.], ack 323696, win 3184, options [nop,nop,TS val 2508690321 ecr 100745784], length 0
23:25:15.525485 IP soccf-snr6-009.d2.comp.nus.edu.sg.55668 > 74.125.24.17.https: Flags [.], ack 326432, win 3184, options [nop,nop,TS val 2508690321 ecr 100745784], length 0
23:25:15.525493 IP soccf-snr6-009.d2.comp.nus.edu.sg.55668 > 74.125.24.17.https: Flags [.], ack 330536, win 3184, options [nop,nop,TS val 2508690321 ecr 100745785], length 0
23:25:15.525578 IP soccf-snr6-009.d2.comp.nus.edu.sg.55668 > 74.125.24.17.https: Flags [.], ack 336008, win 3167, options [nop,nop,TS val 2508690321 ecr 100745786], length 0
23:25:15.525593 IP soccf-snr6-009.d2.comp.nus.edu.sg.55668 > 74.125.24.17.https: Flags [.], ack 338744, win 3152, options [nop,nop,TS val 2508690321 ecr 100745786], length 0
23:25:15.526227 IP soccf-snr6-009.d2.comp.nus.edu.sg.55668 > 74.125.24.17.https: Flags [.], ack 342848, win 3184, options [nop,nop,TS val 2508690322 ecr 100745786], length 0
23:25:15.526276 IP soccf-snr6-009.d2.comp.nus.edu.sg.55668 > 74.125.24.17.https: Flags [.], ack 348320, win 3184, options [nop,nop,TS val 2508690322 ecr 100745786], length 0
23:25:15.526335 IP soccf-snr6-009.d2.comp.nus.edu.sg.55668 > 74.125.24.17.https: Flags [.], ack 355160, win 3167, options [nop,nop,TS val 2508690322 ecr 100745786], length 0
23:25:15.526379 IP soccf-snr6-009.d2.comp.nus.edu.sg.55668 > 74.125.24.17.https: Flags [.], ack 359264, win 3145, options [nop,nop,TS val 2508690322 ecr 100745786], length 0
23:25:15.527408 IP soccf-snr6-009.d2.comp.nus.edu.sg.55668 > 74.125.24.17.https: Flags [.], ack 363368, win 3184, options [nop,nop,TS val 2508690323 ecr 100745787], length 0
23:25:15.527456 IP soccf-snr6-009.d2.comp.nus.edu.sg.55668 > 74.125.24.17.https: Flags [.], ack 368840, win 3269, options [nop,nop,TS val 2508690323 ecr 100745787], length 0
23:25:15.527504 IP soccf-snr6-009.d2.comp.nus.edu.sg.55668 > 74.125.24.17.https: Flags [.], ack 375680, win 3376, options [nop,nop,TS val 2508690323 ecr 100745787], length 0
23:25:15.527552 IP soccf-snr6-009.d2.comp.nus.edu.sg.55668 > 74.125.24.17.https: Flags [.], ack 378416, win 3419, options [nop,nop,TS val 2508690323 ecr 100745787], length 0
23:25:15.528401 IP soccf-snr6-009.d2.comp.nus.edu.sg.55668 > 74.125.24.17.https: Flags [.], ack 382520, win 3483, options [nop,nop,TS val 2508690324 ecr 100745787], length 0
23:25:15.528452 IP soccf-snr6-009.d2.comp.nus.edu.sg.55668 > 74.125.24.17.https: Flags [.], ack 389360, win 3590, options [nop,nop,TS val 2508690324 ecr 100745787], length 0
23:25:15.528497 IP soccf-snr6-009.d2.comp.nus.edu.sg.55668 > 74.125.24.17.https: Flags [.], ack 394832, win 3675, options [nop,nop,TS val 2508690324 ecr 100745787], length 0
23:25:15.528543 IP soccf-snr6-009.d2.comp.nus.edu.sg.55668 > 74.125.24.17.https: Flags [.], ack 397568, win 3718, options [nop,nop,TS val 2508690324 ecr 100745788], length 0
23:25:15.529427 IP soccf-snr6-009.d2.comp.nus.edu.sg.55668 > 74.125.24.17.https: Flags [.], ack 403040, win 3803, options [nop,nop,TS val 2508690325 ecr 100745788], length 0
23:25:15.529466 IP soccf-snr6-009.d2.comp.nus.edu.sg.55668 > 74.125.24.17.https: Flags [.], ack 407144, win 3868, options [nop,nop,TS val 2508690325 ecr 100745788], length 0
23:25:15.529516 IP soccf-snr6-009.d2.comp.nus.edu.sg.55668 > 74.125.24.17.https: Flags [.], ack 413984, win 3974, options [nop,nop,TS val 2508690325 ecr 100745788], length 0
23:25:15.529563 IP soccf-snr6-009.d2.comp.nus.edu.sg.55668 > 74.125.24.17.https: Flags [.], ack 418088, win 4039, options [nop,nop,TS val 2508690325 ecr 100745788], length 0
23:25:15.530219 IP soccf-snr6-009.d2.comp.nus.edu.sg.55668 > 74.125.24.17.https: Flags [.], ack 422192, win 4103, options [nop,nop,TS val 2508690326 ecr 100745788], length 0
23:25:15.530269 IP soccf-snr6-009.d2.comp.nus.edu.sg.55668 > 74.125.24.17.https: Flags [.], ack 427664, win 4188, options [nop,nop,TS val 2508690326 ecr 100745788], length 0
23:25:15.530320 IP soccf-snr6-009.d2.comp.nus.edu.sg.55668 > 74.125.24.17.https: Flags [.], ack 434504, win 4295, options [nop,nop,TS val 2508690326 ecr 100745788], length 0
23:25:15.530369 IP soccf-snr6-009.d2.comp.nus.edu.sg.55668 > 74.125.24.17.https: Flags [.], ack 437240, win 4340, options [nop,nop,TS val 2508690326 ecr 100745788], length 0
23:25:15.531403 IP soccf-snr6-009.d2.comp.nus.edu.sg.55668 > 74.125.24.17.https: Flags [.], ack 441344, win 4404, options [nop,nop,TS val 2508690327 ecr 100745788], length 0
23:25:15.531451 IP soccf-snr6-009.d2.comp.nus.edu.sg.55668 > 74.125.24.17.https: Flags [.], ack 446816, win 4490, options [nop,nop,TS val 2508690327 ecr 100745788], length 0
23:25:15.531505 IP soccf-snr6-009.d2.comp.nus.edu.sg.55668 > 74.125.24.17.https: Flags [.], ack 453656, win 4597, options [nop,nop,TS val 2508690327 ecr 100745788], length 0
23:25:15.531552 IP soccf-snr6-009.d2.comp.nus.edu.sg.55668 > 74.125.24.17.https: Flags [.], ack 457760, win 4661, options [nop,nop,TS val 2508690327 ecr 100745788], length 0
23:25:15.532389 IP soccf-snr6-009.d2.comp.nus.edu.sg.55668 > 74.125.24.17.https: Flags [.], ack 461864, win 4701, options [nop,nop,TS val 2508690328 ecr 100745788], length 0
23:25:15.532438 IP soccf-snr6-009.d2.comp.nus.edu.sg.55668 > 74.125.24.17.https: Flags [.], ack 468704, win 4701, options [nop,nop,TS val 2508690328 ecr 100745789], length 0
23:25:15.532486 IP soccf-snr6-009.d2.comp.nus.edu.sg.55668 > 74.125.24.17.https: Flags [.], ack 474176, win 4701, options [nop,nop,TS val 2508690328 ecr 100745790], length 0
23:25:15.532537 IP soccf-snr6-009.d2.comp.nus.edu.sg.55668 > 74.125.24.17.https: Flags [.], ack 476912, win 4701, options [nop,nop,TS val 2508690328 ecr 100745790], length 0
23:25:15.533367 IP soccf-snr6-009.d2.comp.nus.edu.sg.55668 > 74.125.24.17.https: Flags [.], ack 481016, win 4701, options [nop,nop,TS val 2508690329 ecr 100745790], length 0
23:25:15.533417 IP soccf-snr6-009.d2.comp.nus.edu.sg.55668 > 74.125.24.17.https: Flags [.], ack 486488, win 4701, options [nop,nop,TS val 2508690329 ecr 100745790], length 0
23:25:15.533465 IP soccf-snr6-009.d2.comp.nus.edu.sg.55668 > 74.125.24.17.https: Flags [.], ack 493328, win 4701, options [nop,nop,TS val 2508690329 ecr 100745790], length 0
23:25:15.533526 IP soccf-snr6-009.d2.comp.nus.edu.sg.55668 > 74.125.24.17.https: Flags [.], ack 497432, win 4698, options [nop,nop,TS val 2508690329 ecr 100745791], length 0
23:25:15.534236 IP soccf-snr6-009.d2.comp.nus.edu.sg.55668 > 74.125.24.17.https: Flags [.], ack 500168, win 4701, options [nop,nop,TS val 2508690330 ecr 100745791], length 0
23:25:15.534245 IP soccf-snr6-009.d2.comp.nus.edu.sg.55668 > 74.125.24.17.https: Flags [.], ack 504272, win 4701, options [nop,nop,TS val 2508690330 ecr 100745792], length 0
23:25:15.534269 IP soccf-snr6-009.d2.comp.nus.edu.sg.55668 > 74.125.24.17.https: Flags [.], ack 507008, win 4701, options [nop,nop,TS val 2508690330 ecr 100745792], length 0
23:25:15.534321 IP soccf-snr6-009.d2.comp.nus.edu.sg.55668 > 74.125.24.17.https: Flags [.], ack 513848, win 4701, options [nop,nop,TS val 2508690330 ecr 100745792], length 0
23:25:15.535400 IP soccf-snr6-009.d2.comp.nus.edu.sg.55668 > 74.125.24.17.https: Flags [.], ack 519320, win 4701, options [nop,nop,TS val 2508690331 ecr 100745792], length 0
23:25:15.535447 IP soccf-snr6-009.d2.comp.nus.edu.sg.55668 > 74.125.24.17.https: Flags [.], ack 523424, win 4701, options [nop,nop,TS val 2508690331 ecr 100745792], length 0
23:25:15.535453 IP soccf-snr6-009.d2.comp.nus.edu.sg.55668 > 74.125.24.17.https: Flags [.], ack 526160, win 4701, options [nop,nop,TS val 2508690331 ecr 100745793], length 0
23:25:15.535496 IP soccf-snr6-009.d2.comp.nus.edu.sg.55668 > 74.125.24.17.https: Flags [.], ack 530264, win 4701, options [nop,nop,TS val 2508690331 ecr 100745793], length 0
23:25:15.535548 IP soccf-snr6-009.d2.comp.nus.edu.sg.55668 > 74.125.24.17.https: Flags [.], ack 535736, win 4701, options [nop,nop,TS val 2508690331 ecr 100745793], length 0
23:25:15.536237 IP soccf-snr6-009.d2.comp.nus.edu.sg.55668 > 74.125.24.17.https: Flags [.], ack 542576, win 4701, options [nop,nop,TS val 2508690332 ecr 100745793], length 0
23:25:15.536268 IP soccf-snr6-009.d2.comp.nus.edu.sg.55668 > 74.125.24.17.https: Flags [.], ack 545312, win 4701, options [nop,nop,TS val 2508690332 ecr 100745793], length 0
23:25:15.536319 IP soccf-snr6-009.d2.comp.nus.edu.sg.55668 > 74.125.24.17.https: Flags [.], ack 552152, win 4701, options [nop,nop,TS val 2508690332 ecr 100745793], length 0
23:25:15.536365 IP soccf-snr6-009.d2.comp.nus.edu.sg.55668 > 74.125.24.17.https: Flags [.], ack 554888, win 4701, options [nop,nop,TS val 2508690332 ecr 100745794], length 0
23:25:15.537259 IP soccf-snr6-009.d2.comp.nus.edu.sg.55668 > 74.125.24.17.https: Flags [.], ack 560360, win 4701, options [nop,nop,TS val 2508690333 ecr 100745794], length 0
23:25:15.537293 IP soccf-snr6-009.d2.comp.nus.edu.sg.55668 > 74.125.24.17.https: Flags [.], ack 564464, win 4744, options [nop,nop,TS val 2508690333 ecr 100745795], length 0
23:25:15.537342 IP soccf-snr6-009.d2.comp.nus.edu.sg.55668 > 74.125.24.17.https: Flags [.], ack 571304, win 4840, options [nop,nop,TS val 2508690333 ecr 100745795], length 0
23:25:15.537390 IP soccf-snr6-009.d2.comp.nus.edu.sg.55668 > 74.125.24.17.https: Flags [.], ack 574040, win 4840, options [nop,nop,TS val 2508690333 ecr 100745795], length 0
23:25:15.538274 IP soccf-snr6-009.d2.comp.nus.edu.sg.55668 > 74.125.24.17.https: Flags [.], ack 580880, win 4840, options [nop,nop,TS val 2508690334 ecr 100745795], length 0
23:25:15.538298 IP soccf-snr6-009.d2.comp.nus.edu.sg.55668 > 74.125.24.17.https: Flags [.], ack 583616, win 4840, options [nop,nop,TS val 2508690334 ecr 100745795], length 0
23:25:15.538347 IP soccf-snr6-009.d2.comp.nus.edu.sg.55668 > 74.125.24.17.https: Flags [.], ack 587720, win 4840, options [nop,nop,TS val 2508690334 ecr 100745795], length 0
23:25:15.538356 IP soccf-snr6-009.d2.comp.nus.edu.sg.55668 > 74.125.24.17.https: Flags [.], ack 590456, win 4840, options [nop,nop,TS val 2508690334 ecr 100745796], length 0
23:25:15.538396 IP soccf-snr6-009.d2.comp.nus.edu.sg.55668 > 74.125.24.17.https: Flags [.], ack 593192, win 4840, options [nop,nop,TS val 2508690334 ecr 100745796], length 0
23:25:15.539252 IP soccf-snr6-009.d2.comp.nus.edu.sg.55668 > 74.125.24.17.https: Flags [.], ack 597296, win 4840, options [nop,nop,TS val 2508690335 ecr 100745796], length 0
23:25:15.539300 IP soccf-snr6-009.d2.comp.nus.edu.sg.55668 > 74.125.24.17.https: Flags [.], ack 600032, win 4840, options [nop,nop,TS val 2508690335 ecr 100745796], length 0
23:25:15.539310 IP soccf-snr6-009.d2.comp.nus.edu.sg.55668 > 74.125.24.17.https: Flags [.], ack 604136, win 4840, options [nop,nop,TS val 2508690335 ecr 100745797], length 0
23:25:15.539355 IP soccf-snr6-009.d2.comp.nus.edu.sg.55668 > 74.125.24.17.https: Flags [.], ack 609608, win 4840, options [nop,nop,TS val 2508690335 ecr 100745797], length 0
23:25:15.539406 IP soccf-snr6-009.d2.comp.nus.edu.sg.55668 > 74.125.24.17.https: Flags [.], ack 615080, win 4830, options [nop,nop,TS val 2508690335 ecr 100745797], length 0
23:25:15.539457 IP soccf-snr6-009.d2.comp.nus.edu.sg.55668 > 74.125.24.17.https: Flags [.], ack 620552, win 4799, options [nop,nop,TS val 2508690335 ecr 100745797], length 0
23:25:15.539508 IP soccf-snr6-009.d2.comp.nus.edu.sg.55668 > 74.125.24.17.https: Flags [.], ack 626024, win 4769, options [nop,nop,TS val 2508690335 ecr 100745797], length 0
23:25:15.539577 IP soccf-snr6-009.d2.comp.nus.edu.sg.55668 > 74.125.24.17.https: Flags [.], ack 632864, win 4732, options [nop,nop,TS val 2508690335 ecr 100745797], length 0
23:25:15.539616 IP soccf-snr6-009.d2.comp.nus.edu.sg.55668 > 74.125.24.17.https: Flags [.], ack 638336, win 4702, options [nop,nop,TS val 2508690335 ecr 100745798], length 0
23:25:15.539651 IP soccf-snr6-009.d2.comp.nus.edu.sg.55668 > 74.125.24.17.https: Flags [.], ack 642440, win 4799, options [nop,nop,TS val 2508690335 ecr 100745798], length 0
23:25:15.540376 IP soccf-snr6-009.d2.comp.nus.edu.sg.55668 > 74.125.24.17.https: Flags [.], ack 646544, win 4840, options [nop,nop,TS val 2508690336 ecr 100745798], length 0
23:25:15.540426 IP soccf-snr6-009.d2.comp.nus.edu.sg.55668 > 74.125.24.17.https: Flags [.], ack 652016, win 4840, options [nop,nop,TS val 2508690336 ecr 100745798], length 0
23:25:15.540478 IP soccf-snr6-009.d2.comp.nus.edu.sg.55668 > 74.125.24.17.https: Flags [.], ack 658856, win 4840, options [nop,nop,TS val 2508690336 ecr 100745799], length 0
23:25:15.540539 IP soccf-snr6-009.d2.comp.nus.edu.sg.55668 > 74.125.24.17.https: Flags [.], ack 664328, win 4830, options [nop,nop,TS val 2508690336 ecr 100745800], length 0
23:25:15.541364 IP soccf-snr6-009.d2.comp.nus.edu.sg.55668 > 74.125.24.17.https: Flags [.], ack 668432, win 4840, options [nop,nop,TS val 2508690337 ecr 100745800], length 0
23:25:15.541414 IP soccf-snr6-009.d2.comp.nus.edu.sg.55668 > 74.125.24.17.https: Flags [.], ack 673904, win 4840, options [nop,nop,TS val 2508690337 ecr 100745800], length 0
23:25:15.541461 IP soccf-snr6-009.d2.comp.nus.edu.sg.55668 > 74.125.24.17.https: Flags [.], ack 678008, win 4840, options [nop,nop,TS val 2508690337 ecr 100745800], length 0
23:25:15.541471 IP soccf-snr6-009.d2.comp.nus.edu.sg.55668 > 74.125.24.17.https: Flags [.], ack 680744, win 4840, options [nop,nop,TS val 2508690337 ecr 100745801], length 0
23:25:15.541520 IP soccf-snr6-009.d2.comp.nus.edu.sg.55668 > 74.125.24.17.https: Flags [.], ack 686216, win 4830, options [nop,nop,TS val 2508690337 ecr 100745801], length 0
23:25:15.541568 IP soccf-snr6-009.d2.comp.nus.edu.sg.55668 > 74.125.24.17.https: Flags [.], ack 688952, win 4815, options [nop,nop,TS val 2508690337 ecr 100745801], length 0
23:25:15.542226 IP soccf-snr6-009.d2.comp.nus.edu.sg.55668 > 74.125.24.17.https: Flags [.], ack 693056, win 4840, options [nop,nop,TS val 2508690338 ecr 100745801], length 0
23:25:15.542277 IP soccf-snr6-009.d2.comp.nus.edu.sg.55668 > 74.125.24.17.https: Flags [.], ack 698528, win 4840, options [nop,nop,TS val 2508690338 ecr 100745801], length 0
23:25:15.542327 IP soccf-snr6-009.d2.comp.nus.edu.sg.55668 > 74.125.24.17.https: Flags [.], ack 705368, win 4840, options [nop,nop,TS val 2508690338 ecr 100745801], length 0
23:25:15.542393 IP soccf-snr6-009.d2.comp.nus.edu.sg.55668 > 74.125.24.17.https: Flags [.], ack 710840, win 4830, options [nop,nop,TS val 2508690338 ecr 100745801], length 0
23:25:15.543399 IP soccf-snr6-009.d2.comp.nus.edu.sg.55668 > 74.125.24.17.https: Flags [.], ack 714944, win 4840, options [nop,nop,TS val 2508690339 ecr 100745802], length 0
23:25:15.543446 IP soccf-snr6-009.d2.comp.nus.edu.sg.55668 > 74.125.24.17.https: Flags [.], ack 717575, win 4840, options [nop,nop,TS val 2508690339 ecr 100745802], length 0
23:25:15.543621 IP soccf-snr6-009.d2.comp.nus.edu.sg.55668 > 74.125.24.17.https: Flags [P.], seq 3953:3999, ack 717575, win 4840, options [nop,nop,TS val 2508690339 ecr 100745802], length 46
23:25:15.568928 IP soccf-snr6-009.d2.comp.nus.edu.sg.55668 > 74.125.24.17.https: Flags [P.], seq 3999:4510, ack 717575, win 4840, options [nop,nop,TS val 2508690364 ecr 100745802], length 511
23:25:15.833209 IP soccf-snr6-009.d2.comp.nus.edu.sg.55668 > 74.125.24.17.https: Flags [.], ack 719092, win 4840, options [nop,nop,TS val 2508690629 ecr 100746097], length 0
23:25:15.833222 IP soccf-snr6-009.d2.comp.nus.edu.sg.55668 > 74.125.24.17.https: Flags [.], ack 723196, win 4840, options [nop,nop,TS val 2508690629 ecr 100746097], length 0
23:25:15.833253 IP soccf-snr6-009.d2.comp.nus.edu.sg.55668 > 74.125.24.17.https: Flags [.], ack 725932, win 4840, options [nop,nop,TS val 2508690629 ecr 100746097], length 0
23:25:15.833420 IP soccf-snr6-009.d2.comp.nus.edu.sg.55668 > 74.125.24.17.https: Flags [.], ack 730036, win 4840, options [nop,nop,TS val 2508690629 ecr 100746097], length 0
23:25:15.833455 IP soccf-snr6-009.d2.comp.nus.edu.sg.55668 > 74.125.24.17.https: Flags [.], ack 733773, win 4840, options [nop,nop,TS val 2508690629 ecr 100746097], length 0
23:25:15.833474 IP soccf-snr6-009.d2.comp.nus.edu.sg.55668 > 74.125.24.17.https: Flags [.], ack 737877, win 4838, options [nop,nop,TS val 2508690629 ecr 100746097], length 0
23:25:15.833607 IP soccf-snr6-009.d2.comp.nus.edu.sg.55668 > 74.125.24.17.https: Flags [.], ack 741981, win 4815, options [nop,nop,TS val 2508690629 ecr 100746097], length 0
23:25:15.833843 IP soccf-snr6-009.d2.comp.nus.edu.sg.55668 > 74.125.24.17.https: Flags [.], ack 747453, win 4840, options [nop,nop,TS val 2508690629 ecr 100746097], length 0
23:25:15.833890 IP soccf-snr6-009.d2.comp.nus.edu.sg.55668 > 74.125.24.17.https: Flags [.], ack 750189, win 4840, options [nop,nop,TS val 2508690629 ecr 100746097], length 0
23:25:15.834585 IP soccf-snr6-009.d2.comp.nus.edu.sg.55668 > 74.125.24.17.https: Flags [.], ack 754293, win 4840, options [nop,nop,TS val 2508690630 ecr 100746097], length 0
23:25:15.834634 IP soccf-snr6-009.d2.comp.nus.edu.sg.55668 > 74.125.24.17.https: Flags [.], ack 761133, win 4840, options [nop,nop,TS val 2508690630 ecr 100746097], length 0
23:25:15.834683 IP soccf-snr6-009.d2.comp.nus.edu.sg.55668 > 74.125.24.17.https: Flags [.], ack 767284, win 4840, options [nop,nop,TS val 2508690630 ecr 100746097], length 0
23:25:15.834738 IP soccf-snr6-009.d2.comp.nus.edu.sg.55668 > 74.125.24.17.https: Flags [.], ack 772756, win 4823, options [nop,nop,TS val 2508690630 ecr 100746098], length 0
23:25:15.835366 IP soccf-snr6-009.d2.comp.nus.edu.sg.55668 > 74.125.24.17.https: Flags [.], ack 776860, win 4840, options [nop,nop,TS val 2508690631 ecr 100746098], length 0
23:25:15.835415 IP soccf-snr6-009.d2.comp.nus.edu.sg.55668 > 74.125.24.17.https: Flags [.], ack 782332, win 4840, options [nop,nop,TS val 2508690631 ecr 100746098], length 0
23:25:15.835463 IP soccf-snr6-009.d2.comp.nus.edu.sg.55668 > 74.125.24.17.https: Flags [.], ack 789172, win 4840, options [nop,nop,TS val 2508690631 ecr 100746098], length 0
23:25:15.835521 IP soccf-snr6-009.d2.comp.nus.edu.sg.55668 > 74.125.24.17.https: Flags [.], ack 793276, win 4838, options [nop,nop,TS val 2508690631 ecr 100746098], length 0
23:25:15.836422 IP soccf-snr6-009.d2.comp.nus.edu.sg.55668 > 74.125.24.17.https: Flags [.], ack 797380, win 4840, options [nop,nop,TS val 2508690632 ecr 100746098], length 0
23:25:15.836471 IP soccf-snr6-009.d2.comp.nus.edu.sg.55668 > 74.125.24.17.https: Flags [.], ack 802852, win 4840, options [nop,nop,TS val 2508690632 ecr 100746098], length 0
23:25:15.836520 IP soccf-snr6-009.d2.comp.nus.edu.sg.55668 > 74.125.24.17.https: Flags [.], ack 809692, win 4840, options [nop,nop,TS val 2508690632 ecr 100746098], length 0
23:25:15.836592 IP soccf-snr6-009.d2.comp.nus.edu.sg.55668 > 74.125.24.17.https: Flags [.], ack 815843, win 4823, options [nop,nop,TS val 2508690632 ecr 100746098], length 0
23:25:15.836630 IP soccf-snr6-009.d2.comp.nus.edu.sg.55668 > 74.125.24.17.https: Flags [.], ack 817553, win 4810, options [nop,nop,TS val 2508690632 ecr 100746098], length 0
23:25:15.837408 IP soccf-snr6-009.d2.comp.nus.edu.sg.55668 > 74.125.24.17.https: Flags [.], ack 821657, win 4840, options [nop,nop,TS val 2508690633 ecr 100746098], length 0
23:25:15.837456 IP soccf-snr6-009.d2.comp.nus.edu.sg.55668 > 74.125.24.17.https: Flags [.], ack 827129, win 4840, options [nop,nop,TS val 2508690633 ecr 100746098], length 0
23:25:15.837505 IP soccf-snr6-009.d2.comp.nus.edu.sg.55668 > 74.125.24.17.https: Flags [.], ack 833969, win 4840, options [nop,nop,TS val 2508690633 ecr 100746098], length 0
23:25:15.837570 IP soccf-snr6-009.d2.comp.nus.edu.sg.55668 > 74.125.24.17.https: Flags [.], ack 839441, win 4830, options [nop,nop,TS val 2508690633 ecr 100746098], length 0
